### ISSUE TITLE
Support for RTP under RTSP module

### ISSUE THREAD

**Issue by connected-rramesh** [google/ExoPlayer#9104]
In our project, we would like to just use RTP over UDP to stream a live video. In the current RTSP module , one can see support for `RtspMediaSource`
Eg:
```
MediaSource mediaSource =  new RtspMediaSource.Factory()
                                                 .createMediaSource(MediaItem.fromUri(rtspUri));
```
Does Exoplayer support RtpMediaSource ? Or is there a way to use Rtp protocol for streaming under Rtsp module (2.14.1)?

**Comment by claincly** [comment]
No we don't support playing bare RTP at the moment.

The player preparation, decoder initialization requires the out-of-band data from RTSP.

Could you provide some detail as to how you would transmit those info? Do you play live? What format are you planning on playing?

**Comment by connected-rramesh** [comment]
Thank you for your reply. 
The source is a live camera feed of RTP packets formatted as H.264. We would like play this live feed using Exoplayer. 

Eg: Sample RTP URI
"rtp://192.168.4.21:5000"

**Comment by claincly** [comment]
If I understand you 100%, you are playing a camera feed with video only, and the video in H264, bearing a hard coded payload type (Im guessing 96?)

Do you hard code the sps/pps data also? If so, it will be a lot easier. Where if you don't have sps/pps before hand, it requires some work to initialize the decoder (with a logic very similar to `H264Reader` in the ts package.)

**Comment by connected-rramesh** [comment]
Yes its a video only frame in H264. I am not sure about the payload type of 96. 

We are currently using this ffmpeg command to convert the live camera feed to rtp stream 
`ffmpeg -f v4l2 -framerate 30 -i /dev/video2 -vcodec libx264 -preset ultrafast -tune zerolatency -f rtp rtp://192.168.1.82:5000` 

From the above command I believe we are not hardcoding the sps/pps data during the conversion. 

Below is the dump signifying the variable UDP packets.

` 10:24:47.106382 IP 192.168.1.82.37100 > 19.12.77.220.443: UDP, length 141
   10:24:47.106417 IP 192.168.1.82.37100 > 19.12.77.220.443: UDP, length 1469
   10:24:47.106450 IP 192.168.1.82.37100 > 19.12.77.220.443: UDP, length 173
   10:24:47.106483 IP 192.168.1.82.37100 > 19.12.77.220.443: UDP, length 653
   10:24:47.106609 IP 192.168.1.82.37100 > 19.12.77.220.443: UDP, length 1469
   10:24:47.106648 IP 192.168.1.82.37100 > 19.12.77.220.443: UDP, length 173
   10:24:47.106682 IP 192.168.1.82.37100 > 19.12.77.220.443: UDP, length 1021
   10:24:47.106718 IP 192.168.1.82.37100 > 19.12.77.220.443: UDP, length 1469
   10:24:47.106832 IP 192.168.1.82.37100 > 19.12.77.220.443: UDP, length 173`

If this is the case, what should be the approach that we need to take in order to stream and rtp live feed. Could you also provide some guidance on some sample code to start off.

**Comment by claincly** [comment]
I don't know much about ffmpeg, but I think you can stream RTSP using ffmpeg also, a Google search gave me this command

```
$ ffmpeg -re -stream_loop -1 -i test.mp4 -f rtsp -rtsp_transport tcp rtsp://localhost:8554/live.stream
```

It'll be much easier to use ffmpeg to serve RTSP than modifying ExoPlayer to play an RTP stream.
